{
  "append_gate_status": "PLAN_ONLY_APPEND_APPROVAL_REQUIRED",
  "append_ready_count": 2,
  "append_requires_human_approval": true,
  "blocked_count": 0,
  "boundary_summary": "Runtime Case Collector v0 normalizer creates a private append plan only by default. Runtime candidates are not governed cases until the exact append approval phrase is supplied and the append gate verifies all invariants. No public-safe proof, proof publication, disposition, case closure, SOCaaS, production, autonomous SOC, proof repo, or website mutation is authorized by this plan.",
  "candidates": [
    {
      "ai_decided_disposition": false,
      "ai_support_mode": "AI_SUPPORT_ONLY",
      "append_blocked_reason": "APPEND_APPROVAL_REQUIRED",
      "append_status": "APPEND_READY_REQUIRES_EXACT_APPROVAL",
      "append_to_lifetime_ledger": false,
      "blocked_claims": [
        "public-safe runtime proof",
        "runtime-active public status",
        "signal-observed public status",
        "SOCaaS deployment",
        "production deployment",
        "autonomous SOC",
        "AI-decided disposition",
        "analyst-approved disposition",
        "case closure",
        "Lifetime Case Ledger mutation",
        "public proof publication",
        "proof repo update",
        "website update",
        "GitHub issue creation",
        "raw private evidence upload",
        "candidate count as governed case count",
        "Governance Saves ledger as blocked-claim metrics"
      ],
      "candidate_payload_hash": "5031ce773144630bf7edf7d5ba5599b2faa4230c2e99b3fc93e173a6df07a0ac",
      "case_closed": false,
      "case_status": "RUNTIME_CANDIDATE_ONLY",
      "detection_family": "process_behavior",
      "detection_id": "HO-DET-001",
      "deterministic_close_blocked": true,
      "deterministic_close_eligible": false,
      "disposition_status": "NO_DISPOSITION",
      "human_review_required": true,
      "normalized_candidate_hash": "ba1b4d8342b7fe5c9efc2e68b16d725a289266a9ebaf3003ee20bb710c951b0f",
      "normalized_candidate_id": "rccv0-normalized-ba1b4d8342b7fe5c",
      "normalized_candidate_version": "runtime-case-collector-v0-normalizer",
      "normalized_payload_hash": "6d5782ecba2e75d4eb0cc230e58e6123959c967b17d414b218d948b8c9703292",
      "notes_boundary": "Runtime Case Collector v0 normalizer creates a private append plan only by default. Runtime candidates are not governed cases until the exact append approval phrase is supplied and the append gate verifies all invariants. No public-safe proof, proof publication, disposition, case closure, SOCaaS, production, autonomous SOC, proof repo, or website mutation is authorized by this plan.",
      "observed_time_utc": "2026-06-02T00:00:00Z",
      "proof_ceiling": "RUNTIME_CASE_COLLECTOR_V0_NORMALIZER_APPEND_GATE_EXISTS_NO_LEDGER_MUTATION_UNLESS_APPEND_APPROVED",
      "public_safe_status": "NOT_PUBLIC_SAFE",
      "runtime_truth_status": "PRIVATE_CANDIDATE_ONLY",
      "sanitized_event_fingerprint": "windows-route-probe-ho-det-001-v0",
      "signal_truth_status": "NOT_PUBLIC_SIGNAL_PROOF",
      "source_candidate_hash": "cc6ce762092018a1097528e641d6ced76738d62556812084684d015c98797e18",
      "source_candidate_id": "rccv0-win-cc6ce762092018a1",
      "source_collector_lane": "windows",
      "source_collector_run_id": "runtime-case-collector-v0-windows-dry-run",
      "source_collector_version": "runtime-case-collector-v0-windows",
      "source_receipt_refs": [
        {
          "ref": "26849122652",
          "ref_type": "github_actions_run",
          "status": "pass"
        }
      ],
      "source_receipt_refs_hash": "e28bfd341e3677b4aa1352262d7a19488acc570e7037b20e14dbc9d81d7c4291",
      "source_system": "windows_private_route_probe",
      "triage_status": "HUMAN_REVIEW_REQUIRED"
    },
    {
      "ai_decided_disposition": false,
      "ai_support_mode": "AI_SUPPORT_ONLY",
      "append_blocked_reason": "APPEND_APPROVAL_REQUIRED",
      "append_status": "APPEND_READY_REQUIRES_EXACT_APPROVAL",
      "append_to_lifetime_ledger": false,
      "blocked_claims": [
        "public-safe runtime proof",
        "runtime-active public status",
        "signal-observed public status",
        "SOCaaS deployment",
        "production deployment",
        "autonomous SOC",
        "AI-decided disposition",
        "analyst-approved disposition",
        "case closure",
        "Lifetime Case Ledger mutation",
        "public proof publication",
        "proof repo update",
        "website update",
        "GitHub issue creation",
        "raw private evidence upload",
        "candidate count as governed case count",
        "Governance Saves ledger as blocked-claim metrics"
      ],
      "candidate_payload_hash": "02bb3acb3ab7b1530d55849e06270d4eb86142f79b01d73d58e8a99619f1a93b",
      "case_closed": false,
      "case_status": "RUNTIME_CANDIDATE_ONLY",
      "detection_family": "process_behavior",
      "detection_id": "HO-DET-001",
      "deterministic_close_blocked": true,
      "deterministic_close_eligible": false,
      "disposition_status": "NO_DISPOSITION",
      "human_review_required": true,
      "normalized_candidate_hash": "a7a60d9141b653b871769d644b93eb274a8d4810a42ce1e12099dde34eb4d0fb",
      "normalized_candidate_id": "rccv0-normalized-a7a60d9141b653b8",
      "normalized_candidate_version": "runtime-case-collector-v0-normalizer",
      "normalized_payload_hash": "f594ea37cba953c1bc7b49158dea749d446bdf1ecc3ba1aac5fe2d5faf8d4049",
      "notes_boundary": "Runtime Case Collector v0 normalizer creates a private append plan only by default. Runtime candidates are not governed cases until the exact append approval phrase is supplied and the append gate verifies all invariants. No public-safe proof, proof publication, disposition, case closure, SOCaaS, production, autonomous SOC, proof repo, or website mutation is authorized by this plan.",
      "observed_time_utc": "2026-05-17T23:59:30Z",
      "proof_ceiling": "RUNTIME_CASE_COLLECTOR_V0_NORMALIZER_APPEND_GATE_EXISTS_NO_LEDGER_MUTATION_UNLESS_APPEND_APPROVED",
      "public_safe_status": "NOT_PUBLIC_SAFE",
      "runtime_truth_status": "PRIVATE_CANDIDATE_ONLY",
      "sanitized_event_fingerprint": "linux-runner-ho-gpu-01-runtime-candidate-v0",
      "signal_truth_status": "NOT_PUBLIC_SIGNAL_PROOF",
      "source_candidate_hash": "8bb7731c8d3915b1f64fed8440e684d430f4e14da50c0d41e7aac40d7692c55e",
      "source_candidate_id": "rccv0-linux-8bb7731c8d3915b1",
      "source_collector_lane": "linux",
      "source_collector_run_id": "runtime-case-collector-v0-linux-dry-run",
      "source_collector_version": "runtime-case-collector-v0-linux",
      "source_receipt_refs": [
        {
          "ref": "26006504673",
          "ref_type": "github_actions_run",
          "status": "pass"
        },
        {
          "ref": "76438823869",
          "ref_type": "github_actions_job",
          "status": "pass"
        }
      ],
      "source_receipt_refs_hash": "51a03c4771b9699512334c64b1a9f6a96eb6dcf7576e841f496d711567fdd17a",
      "source_system": "linux_private_infrastructure_runner",
      "triage_status": "HUMAN_REVIEW_REQUIRED"
    }
  ],
  "duplicate_count": 0,
  "generated_at_utc": "2026-06-02T00:00:00Z",
  "governed_cases_appended": false,
  "lifetime_ledger_mutated": false,
  "normalized_candidate_count": 2,
  "proof_ceiling": "RUNTIME_CASE_COLLECTOR_V0_NORMALIZER_APPEND_GATE_EXISTS_NO_LEDGER_MUTATION_UNLESS_APPEND_APPROVED",
  "public_safe_status": "NOT_PUBLIC_SAFE",
  "rejected_duplicates": [],
  "schema_version": "runtime-case-collector-v0-normalizer",
  "source_linux_candidate_count": 1,
  "source_windows_candidate_count": 1
}
